{
  "$schema": "https://json-schema.org/draft/2020-12/schema",
  "$id": "https://ospp-standard.org/schemas/v1/ble/challenge.schema.json",
  "title": "Challenge",
  "description": "Challenge message notified by the station to the app on BLE characteristic FFF4, answering the Hello. Carries the BLE version the station chose, its nonce and ephemeral key, its certificate, its connectivity and the availability of its services, all signed by the station (06-security.md §6.5.2). It is the app's one source of availability.",
  "type": "object",
  "required": [
    "type",
    "bleVersion",
    "stationNonce",
    "stationEphemeralPubKey",
    "stationCertificate",
    "stationConnectivity",
    "availableServices",
    "catalogDigest",
    "stationSignature"
  ],
  "additionalProperties": false,
  "properties": {
    "type": {
      "type": "string",
      "const": "Challenge",
      "description": "Message type discriminator"
    },
    "bleVersion": {
      "type": "string",
      "pattern": "^\\d+\\.\\d+\\.\\d+$",
      "maxLength": 32,
      "description": "The BLE protocol version of this session: one of the Hello's bleVersions, chosen by the station (profiles/offline/ble-handshake.md §3)."
    },
    "stationNonce": {
      "type": "string",
      "pattern": "^[A-Za-z0-9+/]{43}=$",
      "description": "Base64-encoded 32-byte cryptographically random nonce (exactly 44 Base64 characters; N16 — was minLength:1)."
    },
    "stationEphemeralPubKey": {
      "$ref": "../common/ec-public-key.schema.json",
      "description": "The station's per-handshake ephemeral P-256 public key (compressed SEC1, Base64). ee = ECDH(appEphemeral, stationEphemeral) is the session key's input (06-security.md §6.5), authenticated by stationSignature. Freshly generated per handshake."
    },
    "stationCertificate": {
      "type": "string",
      "pattern": "^[A-Za-z0-9+/]+={0,2}$",
      "minLength": 100,
      "maxLength": 2048,
      "description": "The station's mTLS client certificate, DER, Base64 (06-security.md §4.4), carrying the OSPP BLE station extended key usage. The app validates it against a Station CA of its trust bundle and that CA's CRL before it sends any credential (06-security.md §6.5.2)."
    },
    "stationConnectivity": {
      "type": "string",
      "enum": [
        "Online",
        "Offline"
      ],
      "description": "Current network connectivity status of the station"
    },
    "availableServices": {
      "type": "array",
      "description": "Every service the station's catalog binds to each of its bays, with whether the station can start it now. Signed with the rest of the Challenge, and the app's one source of availability (profiles/offline/ble-transport.md §4). Empty while the station holds no service catalog.",
      "items": {
        "type": "object",
        "required": [
          "bayId",
          "serviceId",
          "available"
        ],
        "additionalProperties": false,
        "properties": {
          "bayId": {
            "$ref": "../common/bay-id.schema.json"
          },
          "serviceId": {
            "$ref": "../common/service-id.schema.json"
          },
          "available": {
            "type": "boolean",
            "description": "Whether the station can start this service on this bay now."
          }
        }
      }
    },
    "catalogDigest": {
      "type": "string",
      "pattern": "^[A-Za-z0-9+/]{43}=$",
      "description": "SHA-256 of the OSPP Canonical Form of the catalog the station serves on FFF2 now, Base64 (44 characters; profiles/offline/ble-transport.md §4). Signed with the rest of the Challenge: the app sends no credential when it differs from the digest of the catalog it chose from (profiles/offline/ble-handshake.md §3)."
    },
    "stationSignature": {
      "type": "string",
      "pattern": "^[A-Za-z0-9+/]+={0,2}$",
      "minLength": 8,
      "maxLength": 128,
      "description": "The station's ECDSA P-256 signature (DER, low-s, Base64) with its certificate key over the content of 06-security.md §6.5.2 - a fixed OSPP context, then a hash of the Hello's wire bytes and of this Challenge without this member, in the OSPP Canonical Form. The station builds that content itself and never signs a digest the app supplies."
    }
  }
}
