{
  "type": "Challenge",
  "bleVersion": "0.3.0",
  "stationNonce": "qirZfzgil4ZA4y85ubxoK3/RvcrY2fGX7Z3T32wDyb8=",
  "stationEphemeralPubKey": "Ap6b/PXlKfqVO14ofK32SHweG+mUCdbgjJwN/696kqbg",
  "stationCertificate": "MIICFzCCAb6gAwIBAgICCgEwCgYIKoZIzj0EAwIwMzESMBAGA1UECgwJT1NQUCBUZXN0MR0wGwYDVQQDDBRPU1BQIFRlc3QgU3RhdGlvbiBDQTAeFw0yNjAxMDEwMDAwMDBaFw0yNjEyMzEyMzU5NTlaMCsxEjAQBgNVBAoMCU9TUFAgVGVzdDEVMBMGA1UEAwwMc3RuX2ExYjJjM2Q0MFkwEwYHKoZIzj0CAQYIKoZIzj0DAQcDQgAEvW5xVrFUPqbSVgurekEFGU2vEdAnOKiJzzxcmZca3/sbE4e/85+t+d3uIbRGsrihNUJo/HPf/t6YnM1w8yTbcKOByTCBxjAMBgNVHRMBAf8EAjAAMA4GA1UdDwEB/wQEAwIHgDAoBgNVHSUEITAfBggrBgEFBQcDAgYTadau1fTCl9KOm5GCxfv1z/qsYzA8BgNVHR8ENTAzMDGgL6AthitodHRwOi8vY3JsLm9zcHAtdGVzdC5pbnZhbGlkL3N0YXRpb24tY2EuY3JsMB0GA1UdDgQWBBQesPd2I89FqUwav1HnI6MMFu/wPjAfBgNVHSMEGDAWgBQXxwEaDwCqARDb92VgH180MkvGWDAKBggqhkjOPQQDAgNHADBEAiB/ntacff4AkpoCFeG36be3OPq/SnS36Yx4J0+xyD6S1wIgT2Cr612Wv5BpWdeXae80hgOpvRPvcZ9UQCs41T2eFSI=",
  "stationConnectivity": "Offline",
  "availableServices": [],
  "catalogDigest": "tydd1/Lr/n96uGXHOoH31mxackVbh/M7xcORvSgeUjw=",
  "stationSignature": "MEQCIH6tonbgK1gGEiWR6IWeNMqZMRD0aNAmBYxlp5mOk1fgAiBxgKHMKL2WNwBmQomFQ+wlURVH9stH8q0s1c33ltVS6g=="
}
