{
  "type": "Challenge",
  "bleVersion": "0.3.0",
  "stationNonce": "wxdN6r13kRS8BBYE6WtBX0D8uUBIZ+FCdt3wFCAWI6E=",
  "stationEphemeralPubKey": "AzyEriXrkQpo/5PSBUoWswYVBwSK4V0Ftwriou88Pm/l",
  "stationCertificate": "MIICFzCCAb6gAwIBAgICCgEwCgYIKoZIzj0EAwIwMzESMBAGA1UECgwJT1NQUCBUZXN0MR0wGwYDVQQDDBRPU1BQIFRlc3QgU3RhdGlvbiBDQTAeFw0yNjAxMDEwMDAwMDBaFw0yNjEyMzEyMzU5NTlaMCsxEjAQBgNVBAoMCU9TUFAgVGVzdDEVMBMGA1UEAwwMc3RuX2ExYjJjM2Q0MFkwEwYHKoZIzj0CAQYIKoZIzj0DAQcDQgAEvW5xVrFUPqbSVgurekEFGU2vEdAnOKiJzzxcmZca3/sbE4e/85+t+d3uIbRGsrihNUJo/HPf/t6YnM1w8yTbcKOByTCBxjAMBgNVHRMBAf8EAjAAMA4GA1UdDwEB/wQEAwIHgDAoBgNVHSUEITAfBggrBgEFBQcDAgYTadau1fTCl9KOm5GCxfv1z/qsYzA8BgNVHR8ENTAzMDGgL6AthitodHRwOi8vY3JsLm9zcHAtdGVzdC5pbnZhbGlkL3N0YXRpb24tY2EuY3JsMB0GA1UdDgQWBBQesPd2I89FqUwav1HnI6MMFu/wPjAfBgNVHSMEGDAWgBQXxwEaDwCqARDb92VgH180MkvGWDAKBggqhkjOPQQDAgNHADBEAiB/ntacff4AkpoCFeG36be3OPq/SnS36Yx4J0+xyD6S1wIgT2Cr612Wv5BpWdeXae80hgOpvRPvcZ9UQCs41T2eFSI=",
  "stationConnectivity": "Offline",
  "availableServices": [
    {
      "bayId": "bay_a1b2c3d4e5f6",
      "serviceId": "svc_eco",
      "available": true
    },
    {
      "bayId": "bay_a1b2c3d4e5f6",
      "serviceId": "svc_standard",
      "available": true
    },
    {
      "bayId": "bay_f6e5d4c3b2a1",
      "serviceId": "svc_eco",
      "available": false
    },
    {
      "bayId": "bay_f6e5d4c3b2a1",
      "serviceId": "svc_deluxe",
      "available": false
    }
  ],
  "catalogDigest": "SmstMPC1FWxN+oDp11QiEPlZY7oqtC/jDumSJCw7xbY=",
  "stationSignature": "MEUCIQC/TA+3W37ZT+jvsUhb5ASqTo5e72p6AB2rLSb5SBvd5gIgDiO5VZJDwhlozh2R66bxevNvC8HFGF/0/3EepRJY2cU="
}
