{
  "type": "Challenge",
  "bleVersion": "0.3.0",
  "stationNonce": "d1Z/mZmaNLJ/SrntW22nb0sHNCbdMF+TsugI93zIm3k=",
  "stationEphemeralPubKey": "A/L8+I3WLIy9eoibSZfFg+QPG/aIjqzvi8HrmbN9VboQ",
  "stationCertificate": "MIICAzCCAamgAwIBAgICCgEwCgYIKoZIzj0EAwIwMzESMBAGA1UECgwJT1NQUCBUZXN0MR0wGwYDVQQDDBRPU1BQIFRlc3QgU3RhdGlvbiBDQTAeFw0yNjAxMDEwMDAwMDBaFw0yNjEyMzEyMzU5NTlaMCsxEjAQBgNVBAoMCU9TUFAgVGVzdDEVMBMGA1UEAwwMc3RuX2ExYjJjM2Q0MFkwEwYHKoZIzj0CAQYIKoZIzj0DAQcDQgAEvW5xVrFUPqbSVgurekEFGU2vEdAnOKiJzzxcmZca3/sbE4e/85+t+d3uIbRGsrihNUJo/HPf/t6YnM1w8yTbcKOBtDCBsTAMBgNVHRMBAf8EAjAAMA4GA1UdDwEB/wQEAwIHgDATBgNVHSUEDDAKBggrBgEFBQcDAjA8BgNVHR8ENTAzMDGgL6AthitodHRwOi8vY3JsLm9zcHAtdGVzdC5pbnZhbGlkL3N0YXRpb24tY2EuY3JsMB0GA1UdDgQWBBQesPd2I89FqUwav1HnI6MMFu/wPjAfBgNVHSMEGDAWgBQXxwEaDwCqARDb92VgH180MkvGWDAKBggqhkjOPQQDAgNIADBFAiA68HnSIWTR3JTm5kYtjZjERKezdDF2N/qyVrM9FHc2DgIhAOv5S9B8HOhYsQOnPW5Qne3CilfGv5/TnrQ6ujO1RK6Q",
  "stationConnectivity": "Online",
  "availableServices": [
    {
      "bayId": "bay_c1d2e3f4a5b6",
      "serviceId": "svc_eco",
      "available": true
    }
  ],
  "catalogDigest": "07pUOHvXhU1hZzsh7JWMj9n7Z5D4TbhEEuSGILeGE1w=",
  "stationSignature": "MEQCIBep5g3ewGIiNsK8JvatCiprcQ4eQz8HBfkuvjcx1K6OAiAtC83P0wPt+FetsiEqHfFmAv/m60STdyDn2skbZePFRw=="
}
